{
  "id": 3,
  "slug": "consultingtype3",
  "excludeNonMainConsultantsFromTeamSessions": false,
  "consultantBoundedToConsultingType": false,
  "sendSaveSessionDataMessage": true,
  "initializeFeedbackChat": true,
  "languageFormal": true,
  "roles": {
    "consultant": {
      "defaultRole": [
        "consultant"
      ]
    }
  },
  "registration": {
    "mandatoryFields": {
      "age": false,
      "state": false
    },
    "notes": {

    }
  },
  "titles": {
    "default": "default",
    "short": "short",
    "long": "long",
    "welcome": "welcome"
  },
  "urls": {
  } ,
  "isSubsequentRegistrationAllowed": false
}
